{"content_hash": "sha256:93cc6c0ca350b6a8e1ea5a066141b6f53b48d0a2dce0a07503d37d92152371cc", "counts": {"lora_a_test.jsonl.valid": 2, "lora_a_train.jsonl.valid": 2, "lora_a_val.jsonl.valid": 2, "lora_b_test.jsonl.valid": 2, "lora_b_train.jsonl.valid": 2, "lora_b_val.jsonl.valid": 2, "rows_invalid": 0, "rows_total": 12, "rows_valid": 12}, "dataset_digest": "sha256:d3701651cdd9343a450cf55e68c9b465368a622759e2736738803d150fcad1d1", "dataset_id": "ds-imp", "rejected_reasons": [], "report_path": "/tmp/tmp.FOzjmOMjfL/w/import_report.json", "status": "PUBLISHED", "version": "vd3701651cdd9"}
