{"content_hash": "sha256:de4459b4865d98e0516e3d46dd60875e50a77727ac14cacb54cac19033a2f301", "counts": {"kind.SEED": 2, "lora_a.VALIDATION": 1, "lora_b.TRAIN": 1, "origin.FAILURE_CASE_SEED": 2}, "dataset_digest": "sha256:f3a4b3d56b1fd42f1a89bab7f7f4f586c5cfaeb6058a7aa04f518743e51d269a", "dataset_id": "ds-dev", "report_path": "/home/user/sdabin/healthKiosk/synthetic-data/work/dev/report.json", "status": "PUBLISHED", "version": "vf3a4b3d56b1f"}
