{
  "content_hash": "sha256:eecd4ffe46d1211c45ca84ea9d6ff3cb431b4965ef35eb3719a5f7570e756cbc",
  "counts": {
    "lora_a_test.jsonl.valid": 3,
    "lora_a_train.jsonl.valid": 3,
    "lora_a_val.jsonl.valid": 3,
    "lora_b_test.jsonl.valid": 3,
    "lora_b_train.jsonl.valid": 3,
    "lora_b_val.jsonl.valid": 3,
    "rows_invalid": 0,
    "rows_total": 18,
    "rows_valid": 18
  },
  "dataset_digest": "sha256:78e29de9668756a9ca532862dbef988262c93842225cd244e97a9e8260f641f2",
  "dataset_id": "ds-import-example",
  "rejected_reasons": [],
  "report_path": "/tmp/sd-contract-ready-lb1_cp_h/iw/import_report.json",
  "status": "PUBLISHED",
  "version": "v78e29de9668756a9ca532862dbef9882"
}
