{
  "content_hash": "sha256:c6bdfc036d7aad04183a407010302631d7e53abba411d4e17d3e9076b5480231",
  "counts": {
    "kind.SEED": 2,
    "lora_a.VALIDATION": 1,
    "lora_b.TRAIN": 1,
    "origin.FAILURE_CASE_SEED": 2
  },
  "dataset_digest": "sha256:f3a4b3d56b1fd42f1a89bab7f7f4f586c5cfaeb6058a7aa04f518743e51d269a",
  "dataset_id": "ds-dev",
  "report_path": "/tmp/sd-contract-ready-lb1_cp_h/work/report.json",
  "status": "ALREADY_PUBLISHED",
  "version": "vf3a4b3d56b1fd42f1a89bab7f7f4f586"
}
